{
  "id": "arch-001",
  "schema_version": "2.2.0",
  "text": "The aphorism itself.",
  "section": "architecture",
  "subsection": "boundaries",
  "level": "advanced",
  "lang": "en",
  "tags": [
    "boundaries",
    "coupling"
  ],
  "teaches": "What the student learns",
  "origin": "legacy-unknown",
  "source": "legacy-source",
  "created_at": "2025-12-06"
}
