{
  "id": "arch-100",
  "schema_version": "3.0.0",
  "content_digest": "e0b8f98d0b7bbbb88ca8dc9538b6c617bfa3fcc4cd6db9138b6b629ef1f52d37",
  "text": "[REDACTED - legally erased under higher-law authority]",
  "section": "architecture",
  "subsection": "boundaries",
  "level": "advanced",
  "lang": "en",
  "tags": [
    "erased"
  ],
  "teaches": "Erasure is a protected exception",
  "origin": "human",
  "status": "erased",
  "reason": "Higher-law erasure authority per institutional decision",
  "effective_at": "2026-08-18T00:00:00Z",
  "created_at": "2025-12-06"
}
