{
  "id": "arch-070",
  "schema_version": "3.0.0",
  "content_digest": "0062d4e6ae0d5c439c8b5a17248ddadec1ea4f4e0e9b772d1ab744a0b98742a8",
  "text": "Let the machine slug carry lineage with a prefix.",
  "section": "architecture",
  "subsection": "boundaries",
  "level": "intermediate",
  "lang": "en",
  "tags": [
    "boundaries",
    "identity"
  ],
  "teaches": "Scope remembers ancestry; speech remembers mercy",
  "origin": "blackbox",
  "validation": {
    "status": "validated",
    "method": "human-review",
    "reviewer_id": "ruvebal@crea-comm.net",
    "activity_id": "review-2026-08-18-001",
    "reviewed_at": "2026-08-18T12:00:00Z",
    "record_digest": "c3d4e5f6a1b2c3d4e5f6a1b2c3d4e5f6a1b2c3d4e5f6a1b2c3d4e5f6a1b2c3d4"
  },
  "created_at": "2026-08-18"
}
